{
  "schema_version": "operational-readiness-decision.v1",
  "artifact_kind": "operational_readiness_decision",
  "created_at": "2026-08-11T21:43:47Z",
  "source_run": {
    "run_id": "validate-20260811T214238Z"
  },
  "candidate_identity": {
    "dataset_slug": "telco-customer-churn",
    "release_id": "release-20260811-001",
    "release_version": "1.0.0-rc.1"
  },
  "source_bindings": {
    "release_candidate": {
      "path": "release-candidate.json",
      "sha256": "5029b00af461dd753ce1ad5730f147154aaa60bd8388ed15ef0ac3e20ad193a3"
    },
    "predictive_bundle": {
      "path": "predictions/bundle.json",
      "sha256": "87399191fc2abbf91b57eaa4f5f3ad9e644a8741136f5f50023961690dcbd058"
    },
    "validated_run_terminal_result": {
      "path": "publisher/runs/validate-20260811T214238Z/validated-run-terminal-result.json",
      "sha256": "33c31dfc9bf62e33f8491a29aaf792bdc1dc498cca754110cb5f4a157e42c4af"
    }
  },
  "source_readiness": {
    "operational_validity": "unconfirmed",
    "operational_threshold": {
      "status": "unresolved",
      "value": null
    },
    "operational_prediction_available": false
  },
  "decision": {
    "operational_validity": "confirmed",
    "operational_threshold": {
      "status": "resolved",
      "value": 1.0,
      "selection_basis": "1"
    },
    "operational_prediction_available": true,
    "decision_basis": "123"
  },
  "boundary_confirmations": {
    "educational_threshold_automatically_promoted": false,
    "model_retrained": false,
    "model_reselected": false,
    "threshold_reoptimized_by_atlas": false,
    "source_run_mutated": false,
    "source_candidate_mutated": false,
    "source_inference_bundle_mutated": false,
    "promotion_invoked": false,
    "registry_mutated": false
  }
}